speciality,symptoms_keywords,age_group,gender_relevance,description
Gynecology,"menstrual problems, irregular periods, pregnancy, PCOS, fertility, ovarian cyst, uterine, prenatal care, postpartum, heavy bleeding, pelvic pain, contraception, menopause",12+,Female,"Specialist for women's reproductive health including pregnancy, menstrual disorders, and hormonal issues"
General Pediatrics,"child fever, growth issues, vaccination, child development, infant care, child rash, child cold, child cough, childhood illness, newborn care, developmental delay",0-14,Any,"General specialist for children's health, growth, development, and common childhood illnesses"
General Physician,"fever, cold, cough, headache, fatigue, body pain, general checkup, blood pressure, diabetes, thyroid, weakness, dizziness, nausea, vomiting, diarrhea, weight loss, joint pain, back pain, chest pain, allergy",Any,Any,"First point of contact for general health concerns, chronic disease management, and preventive care"
Fetal Medicine & Ultrasonography,"fetal scan, anomaly scan, high-risk pregnancy, ultrasound, prenatal diagnosis, genetic screening, fetal growth monitoring, twin pregnancy, placenta issues",Any,Female,"Specialist for monitoring fetal health during pregnancy, high-risk pregnancy management, and prenatal diagnostics"
Pediatric Intensive Care Unit (PICU),"child emergency, breathing difficulty in child, critical care child, child unconscious, child seizure, child accident, severe child infection, child ventilator",0-14,Any,"Emergency and critical care specialist for seriously ill children requiring intensive monitoring and treatment"
Pediatric Pulmonology,"child asthma, child breathing problems, wheezing, child lung infection, child chronic cough, child pneumonia, child bronchitis, child sleep apnea, child tuberculosis",0-14,Any,"Specialist for children's respiratory and lung disorders including asthma, infections, and breathing difficulties"
Pediatric Gastroenterology & Hepatology,"child stomach pain, child digestion problems, child liver issues, child jaundice, child vomiting, child diarrhea, child constipation, child celiac disease, child food allergy, child abdominal pain",0-14,Any,"Specialist for children's digestive system and liver disorders including stomach pain, feeding difficulties, and liver diseases"
